[
  {
    "attempts": 4,
    "channel": "web_search",
    "date_hint": null,
    "event_id": null,
    "id": "men_01edda584071",
    "links": [
      "https://nebraskapublicmedia.org/es/news/news-articles/lincoln-joins-pact-of-42-global-cities-to-set-data-center-standards"
    ],
    "organizer_hint": null,
    "place_hint": null,
    "resolution": "unresolved",
    "title": "Lincoln joins pact of 42 global cities to set data center standards | Nebraska Public Media"
  },
  {
    "attempts": 3,
    "channel": "web_search",
    "date_hint": null,
    "event_id": null,
    "id": "men_02dea083c1b7",
    "links": [
      "https://ruralinnovation.us/blog/building-innovation-in-rural-nebraska-a-look-back-at-the-tech-builders-challenge"
    ],
    "organizer_hint": null,
    "place_hint": null,
    "resolution": "unresolved",
    "title": "A Look Back at the Tech Builders Challenge"
  },
  {
    "attempts": 1,
    "channel": "news",
    "date_hint": null,
    "event_id": null,
    "id": "men_03b01e325c22",
    "links": [],
    "organizer_hint": null,
    "place_hint": null,
    "resolution": "resolved",
    "title": "An anti-terrorism chatbot and protective wear for healthcare: The 2026 Innovation Awards winners"
  },
  {
    "attempts": 4,
    "channel": "web_search",
    "date_hint": null,
    "event_id": null,
    "id": "men_06712557827d",
    "links": [
      "https://www.lincolntech.edu/news/author/lincoln-team"
    ],
    "organizer_hint": null,
    "place_hint": null,
    "resolution": "unresolved",
    "title": "Lincoln Team"
  },
  {
    "attempts": 0,
    "channel": "news",
    "date_hint": "Thursday, Oct. 29",
    "event_id": null,
    "id": "men_06a2ede6216d",
    "links": [
      "https://siliconprairienews.com/"
    ],
    "organizer_hint": "Big Idea Buffalo County",
    "place_hint": "Kearney",
    "resolution": "unresolved",
    "title": "Pitch competition by Big Idea Buffalo County"
  },
  {
    "attempts": 3,
    "channel": "web_search",
    "date_hint": null,
    "event_id": null,
    "id": "men_097e17439592",
    "links": [
      "https://news.unl.edu/article/new-website-connects-communities-with-data-tools-to-thrive"
    ],
    "organizer_hint": null,
    "place_hint": null,
    "resolution": "unresolved",
    "title": "New website connects communities with data, tools to thrive"
  },
  {
    "attempts": 1,
    "channel": "web_search",
    "date_hint": null,
    "event_id": null,
    "id": "men_0c79ca927048",
    "links": [
      "https://www.digitallincoln.co.uk/events-list/2025/4/2/chataimay2025"
    ],
    "organizer_hint": null,
    "place_hint": null,
    "resolution": "resolved",
    "title": "Chat AI Meetup – Exploring Generative AI - Digital Lincoln"
  },
  {
    "attempts": 3,
    "channel": "web_search",
    "date_hint": null,
    "event_id": null,
    "id": "men_0ff7c85a0061",
    "links": [
      "https://securityboulevard.com/2026/10/on-the-silicon-prairie-omahas-cybersecurity-leaders-to-watch"
    ],
    "organizer_hint": null,
    "place_hint": null,
    "resolution": "unresolved",
    "title": "On the Silicon Prairie: Omaha's Cybersecurity Leaders to ..."
  },
  {
    "attempts": 0,
    "channel": "web_search",
    "date_hint": null,
    "event_id": null,
    "id": "men_170a4288cb69",
    "links": [
      "https://www.digitallincoln.co.uk/events-list/2025/9/10/chat-ai"
    ],
    "organizer_hint": null,
    "place_hint": null,
    "resolution": "unresolved",
    "title": "Chat AI Meetup – Exploring Generative AI | Digital Lincoln — Digital Lincoln"
  },
  {
    "attempts": 0,
    "channel": "news",
    "date_hint": "March 2-3, 2027",
    "event_id": null,
    "id": "men_19a1f4fd3259",
    "links": [],
    "organizer_hint": "Nebraska Cures and NWIS",
    "place_hint": "Lincoln, NE",
    "resolution": "unresolved",
    "title": "2027 Nebraska Women in STEM Conference"
  },
  {
    "attempts": 1,
    "channel": "news",
    "date_hint": null,
    "event_id": null,
    "id": "men_1e20914c4053",
    "links": [],
    "organizer_hint": null,
    "place_hint": null,
    "resolution": "unresolved",
    "title": "The post updates from around the ecosystem, October 21 appeared first on Silicon Prairie News."
  },
  {
    "attempts": 0,
    "channel": "web_search",
    "date_hint": null,
    "event_id": null,
    "id": "men_2cf95b75be0d",
    "links": [
      "https://securityboulevard.com/2026/10/on-the-silicon-prairie-omahas-cybersecurity-leaders-to-watch"
    ],
    "organizer_hint": null,
    "place_hint": null,
    "resolution": "unresolved",
    "title": "On the Silicon Prairie: Omaha’s Cybersecurity Leaders to Watch"
  },
  {
    "attempts": 3,
    "channel": "web_search",
    "date_hint": null,
    "event_id": null,
    "id": "men_2d22e9584e96",
    "links": [
      "https://siliconprairienews.com/2026/10/registration-still-open-for-the-tech-nebraska-summit-on-oct-21"
    ],
    "organizer_hint": null,
    "place_hint": null,
    "resolution": "unresolved",
    "title": "Registration still open for the Tech Nebraska Summit on Oct. 21 - Silicon Prairie News"
  },
  {
    "attempts": 3,
    "channel": "web_search",
    "date_hint": null,
    "event_id": null,
    "id": "men_2ddb7f8808e4",
    "links": [
      "https://siliconprairienews.com/2025/05/how-nebraskas-business-ecosystem-is-learning-and-leveraging-ai"
    ],
    "organizer_hint": null,
    "place_hint": null,
    "resolution": "unresolved",
    "title": "How Nebraska's business ecosystem is learning and ..."
  },
  {
    "attempts": 4,
    "channel": "web_search",
    "date_hint": null,
    "event_id": null,
    "id": "men_2f06f865afe4",
    "links": [
      "https://www.rapid7.com/blog/post/2016/07/11/local-cybersecurity-meetups-near-you"
    ],
    "organizer_hint": null,
    "place_hint": null,
    "resolution": "unresolved",
    "title": "Local Cybersecurity Meetups Near You | Rapid7 Blog"
  },
  {
    "attempts": 4,
    "channel": "web_search",
    "date_hint": null,
    "event_id": null,
    "id": "men_3b4096ced2da",
    "links": [
      "https://www.nucamp.co/blog/coding-bootcamp-lincoln-ne-top-10-mustattend-tech-meetups-and-conferences-in-lincoln"
    ],
    "organizer_hint": null,
    "place_hint": null,
    "resolution": "unresolved",
    "title": "Nucamp"
  },
  {
    "attempts": 1,
    "channel": "web_search",
    "date_hint": null,
    "event_id": null,
    "id": "men_3cdb5d2c9ac4",
    "links": [
      "https://www.digitallincoln.co.uk/events-list/2025/9/10/chat-ai"
    ],
    "organizer_hint": null,
    "place_hint": null,
    "resolution": "resolved",
    "title": "Chat AI Meetup – Exploring Generative AI"
  },
  {
    "attempts": 1,
    "channel": "news",
    "date_hint": null,
    "event_id": null,
    "id": "men_3d9cd9e59626",
    "links": [],
    "organizer_hint": null,
    "place_hint": null,
    "resolution": "unresolved",
    "title": "In ‘rug pull,’ DED delayed new BIA contracts for months and left startups with few answers"
  },
  {
    "attempts": 1,
    "channel": "news",
    "date_hint": "Thu, Oct 29",
    "event_id": null,
    "id": "men_3e4c8aabb69e",
    "links": [],
    "organizer_hint": "MCC Small Business Development Center",
    "place_hint": "Omaha, NE",
    "resolution": "unresolved",
    "title": "MCC Small Business Development Center in Omaha is hosting a free workshop on Thursday, Oct. 29, to help entrepreneurs determine if owning a franchise is right for them"
  },
  {
    "attempts": 4,
    "channel": "web_search",
    "date_hint": null,
    "event_id": null,
    "id": "men_45c78272e436",
    "links": [
      "https://www.lincolninternational.com/perspectives/articles/cyber-roadmap-2025-and-beyond"
    ],
    "organizer_hint": null,
    "place_hint": null,
    "resolution": "unresolved",
    "title": "Cyber Roadmap: 2025 and beyond - Lincoln International LLC"
  },
  {
    "attempts": 3,
    "channel": "web_search",
    "date_hint": null,
    "event_id": null,
    "id": "men_4cdb0ea9d4b1",
    "links": [
      "https://www.integrate.io/blog/data-conferences-nebraska"
    ],
    "organizer_hint": null,
    "place_hint": null,
    "resolution": "unresolved",
    "title": "List of Data Conferences in Nebraska - 2026 | Integrate.io"
  },
  {
    "attempts": 4,
    "channel": "web_search",
    "date_hint": null,
    "event_id": null,
    "id": "men_4d037b4deb5f",
    "links": [
      "https://www.nucamp.co/blog/coding-bootcamp-lincoln-ne-top-10-mustattend-tech-meetups-and-conferences-in-lincoln"
    ],
    "organizer_hint": null,
    "place_hint": null,
    "resolution": "unresolved",
    "title": "AI Meetups, Communities, and Networking Events in Lincoln ..."
  },
  {
    "attempts": 4,
    "channel": "web_search",
    "date_hint": null,
    "event_id": null,
    "id": "men_4d3fcce8141c",
    "links": [
      "https://www.lcsnc.org/article/3189625"
    ],
    "organizer_hint": null,
    "place_hint": null,
    "resolution": "unresolved",
    "title": "October is Cybersecurity Awareness Month | Lincoln County Schools"
  },
  {
    "attempts": 0,
    "channel": "news",
    "date_hint": "Saturday, Nov. 7",
    "event_id": null,
    "id": "men_5782f2c970c4",
    "links": [
      "https://siliconprairienews.com/"
    ],
    "organizer_hint": "PowerPath Collective",
    "place_hint": "Catalyst Omaha",
    "resolution": "unresolved",
    "title": "PowerPath Collective AI skills event"
  },
  {
    "attempts": 1,
    "channel": "news",
    "date_hint": "March 2-3",
    "event_id": null,
    "id": "men_600c69c560ba",
    "links": [
      "https://siliconprairienews.com/"
    ],
    "organizer_hint": "Nebraska Cures and NWIS",
    "place_hint": "Lincoln",
    "resolution": "unresolved",
    "title": "2027 Nebraska Women in STEM Conference"
  },
  {
    "attempts": 0,
    "channel": "news",
    "date_hint": "Wednesday evening during Innovation Week Oct. 12-16, 2026",
    "event_id": null,
    "id": "men_616e3f79515c",
    "links": [],